{"revision_id":"550e8400-e29b-41d4-a716-446655440001","status":"active","payload_sha256":"2222222222222222222222222222222222222222222222222222222222222222","payload":{"model_set_id":"pdm-production","model_set_version":"2026.09.02","updated_at":"2026-09-02T00:00:00Z","models":{"pdm-lightgbm":{"model_version":"1.2.0","required":true}}},"created_at":"2026-09-02T00:00:00Z"}
